<?xml version="1.0" encoding="UTF-8"?>
<DSKS xmlns:xsi="http://www.w3.org/2001/XMLSchema-instance"
 xsi:noNamespaceSchemaLocation="file:/D:/HK2-thirdYear/XML/repos/QLKS.xsd">
    <Khachsan>
        <MaKS>AA00</MaKS>
        <tenKS>tenKS0</tenKS>
        <Diachi>Diachi0</Diachi>
    </Khachsan>
    <Khachsan>
        <MaKS>AA00</MaKS>
        <tenKS>tenKS1</tenKS>
        <Diachi>Diachi1</Diachi>
    </Khachsan>
    <Phong>
        <MaKS>AA00</MaKS>
        <Maphong>PA00</Maphong>
        <TenLoai>TenLoai0</TenLoai>
        <Dongia>0</Dongia>
        <MaLP>LA00</MaLP>
    </Phong>
    <Phong>
        <MaKS>AA00</MaKS>
        <Maphong>PA00</Maphong>
        <TenLoai>TenLoai1</TenLoai>
        <Dongia>0</Dongia>
        <MaLP>LA00</MaLP>
    </Phong>
    <LoaiPhong>
        <MaLP>LA00</MaLP>
        <tenPhong>tenPhong0</tenPhong>
        <lau>0</lau>
        <SDT>SDT0</SDT>
    </LoaiPhong>
    <LoaiPhong>
        <MaLP>LA00</MaLP>
        <tenPhong>tenPhong1</tenPhong>
        <lau>0</lau>
        <SDT>SDT1</SDT>
    </LoaiPhong>
    <DichVu>
        <MaDichVu>DA00</MaDichVu>
        <tenDV>tenDV0</tenDV>
        <dongia>0</dongia>
    </DichVu>
    <DichVu>
        <MaDichVu>DA00</MaDichVu>
        <tenDV>tenDV1</tenDV>
        <dongia>0</dongia>
    </DichVu>
    <KhachHang>
        <MaKH>HA00</MaKH>
        <tenKH>tenKH0</tenKH>
        <DC>DC0</DC>
        <CMND>CMND0</CMND>
        <SDT>SDT2</SDT>
    </KhachHang>
    <KhachHang>
        <MaKH>HA00</MaKH>
        <tenKH>tenKH1</tenKH>
        <DC>DC1</DC>
        <CMND>CMND1</CMND>
        <SDT>SDT3</SDT>
    </KhachHang>
    <HoaDon>
        <MaHD>DA00</MaHD>
        <ngayden>2006-05-04</ngayden>
        <ngaydi>2006-05-04</ngaydi>
        <MaPhong>PA00</MaPhong>
        <MaKH>HA00</MaKH>
        <thanhTien>
        </thanhTien>
        <MaDV>DA00</MaDV>
    </HoaDon>
    <HoaDon>
        <MaHD>DA00</MaHD>
        <ngayden>2006-05-04</ngayden>
        <ngaydi>2006-05-04</ngaydi>
        <MaPhong>PA00</MaPhong>
        <MaKH>HA00</MaKH>
        <thanhTien>
        </thanhTien>
        <MaDV>DA00</MaDV>
    </HoaDon>
</DSKS>
